{
  "$id": "palette.schema.json",
  "$schema": "https://json-schema.org/draft/2020-12/schema",
  "additionalProperties": false,
  "description": "data/ui/palette.json (UH-6, D5): the ~18 C_* module constants game/ui/widgets.py ships, as schema-checked committed data. Loaded once at boot (game/main.py) and passed to game.ui.widgets.configure_palette, which rebinds each widgets.C_* attribute (mechanical \"C_\" + key.upper() mapping); the unconfigured module defaults equal this file's stock content (tools/tests/test_theme_data.py pins it). This IS the C_* block, nothing more — widgets.COND_LABELS colors and every other inline color literal in game/ui stay code, deliberately out of scope. All keys are required: a missing one would leave some widgets.C_* constant silently un-rebound.",
  "properties": {
    "gold": {
      "description": "Love/currency accent — gold text, highlights, the love-pill count.",
      "items": {
        "maximum": 255,
        "minimum": 0,
        "type": "integer"
      },
      "maxItems": 3,
      "minItems": 3,
      "type": "array"
    },
    "green_stat": {
      "description": "Positive stat callouts — level-up upgrade text, income deltas.",
      "items": {
        "maximum": 255,
        "minimum": 0,
        "type": "integer"
      },
      "maxItems": 3,
      "minItems": 3,
      "type": "array"
    },
    "highlight": {
      "description": "Selected-tile outline color.",
      "items": {
        "maximum": 255,
        "minimum": 0,
        "type": "integer"
      },
      "maxItems": 3,
      "minItems": 3,
      "type": "array"
    },
    "highlight2": {
      "description": "Unlock-area tile outline color (the tiles around a selection).",
      "items": {
        "maximum": 255,
        "minimum": 0,
        "type": "integer"
      },
      "maxItems": 3,
      "minItems": 3,
      "type": "array"
    },
    "hp_green": {
      "description": "HP/health bar fill color (healthy).",
      "items": {
        "maximum": 255,
        "minimum": 0,
        "type": "integer"
      },
      "maxItems": 3,
      "minItems": 3,
      "type": "array"
    },
    "hp_red": {
      "description": "HP/health bar background color (low/lost health).",
      "items": {
        "maximum": 255,
        "minimum": 0,
        "type": "integer"
      },
      "maxItems": 3,
      "minItems": 3,
      "type": "array"
    },
    "panel_inset": {
      "description": "HUD \"stone pill\" panel inset border color.",
      "items": {
        "maximum": 255,
        "minimum": 0,
        "type": "integer"
      },
      "maxItems": 3,
      "minItems": 3,
      "type": "array"
    },
    "panel_stone": {
      "description": "HUD \"stone pill\" panel body fill color.",
      "items": {
        "maximum": 255,
        "minimum": 0,
        "type": "integer"
      },
      "maxItems": 3,
      "minItems": 3,
      "type": "array"
    },
    "range_highlight": {
      "description": "Defence attack-range tile overlay color.",
      "items": {
        "maximum": 255,
        "minimum": 0,
        "type": "integer"
      },
      "maxItems": 3,
      "minItems": 3,
      "type": "array"
    },
    "red": {
      "description": "Danger/destructive accent — combat phase banner, cost warnings, errors.",
      "items": {
        "maximum": 255,
        "minimum": 0,
        "type": "integer"
      },
      "maxItems": 3,
      "minItems": 3,
      "type": "array"
    },
    "ui_border": {
      "description": "Default unskinned panel/button border color.",
      "items": {
        "maximum": 255,
        "minimum": 0,
        "type": "integer"
      },
      "maxItems": 3,
      "minItems": 3,
      "type": "array"
    },
    "ui_btn": {
      "description": "Default unskinned button fill color (idle).",
      "items": {
        "maximum": 255,
        "minimum": 0,
        "type": "integer"
      },
      "maxItems": 3,
      "minItems": 3,
      "type": "array"
    },
    "ui_btn_active": {
      "description": "Default unskinned button fill color (pressed/active).",
      "items": {
        "maximum": 255,
        "minimum": 0,
        "type": "integer"
      },
      "maxItems": 3,
      "minItems": 3,
      "type": "array"
    },
    "ui_btn_disabled": {
      "description": "Default unskinned button fill color (disabled).",
      "items": {
        "maximum": 255,
        "minimum": 0,
        "type": "integer"
      },
      "maxItems": 3,
      "minItems": 3,
      "type": "array"
    },
    "ui_btn_hover": {
      "description": "Default unskinned button fill color (hovered).",
      "items": {
        "maximum": 255,
        "minimum": 0,
        "type": "integer"
      },
      "maxItems": 3,
      "minItems": 3,
      "type": "array"
    },
    "ui_panel": {
      "description": "Default unskinned panel fill color.",
      "items": {
        "maximum": 255,
        "minimum": 0,
        "type": "integer"
      },
      "maxItems": 3,
      "minItems": 3,
      "type": "array"
    },
    "ui_text": {
      "description": "Primary UI text color.",
      "items": {
        "maximum": 255,
        "minimum": 0,
        "type": "integer"
      },
      "maxItems": 3,
      "minItems": 3,
      "type": "array"
    },
    "ui_text_dim": {
      "description": "Secondary/dim UI text color.",
      "items": {
        "maximum": 255,
        "minimum": 0,
        "type": "integer"
      },
      "maxItems": 3,
      "minItems": 3,
      "type": "array"
    }
  },
  "required": [
    "gold",
    "green_stat",
    "highlight",
    "highlight2",
    "hp_green",
    "hp_red",
    "panel_inset",
    "panel_stone",
    "range_highlight",
    "red",
    "ui_border",
    "ui_btn",
    "ui_btn_active",
    "ui_btn_disabled",
    "ui_btn_hover",
    "ui_panel",
    "ui_text",
    "ui_text_dim"
  ],
  "title": "palette",
  "type": "object"
}
