{
  "gold": [
    255,
    200,
    50
  ],
  "green_stat": [
    80,
    210,
    80
  ],
  "highlight": [
    255,
    230,
    60
  ],
  "highlight2": [
    255,
    180,
    60
  ],
  "hp_green": [
    55,
    195,
    55
  ],
  "hp_red": [
    200,
    55,
    55
  ],
  "panel_inset": [
    150,
    135,
    185
  ],
  "panel_stone": [
    40,
    32,
    58
  ],
  "range_highlight": [
    180,
    40,
    40
  ],
  "red": [
    210,
    55,
    55
  ],
  "ui_border": [
    80,
    65,
    120
  ],
  "ui_btn": [
    75,
    60,
    115
  ],
  "ui_btn_active": [
    60,
    140,
    60
  ],
  "ui_btn_disabled": [
    50,
    45,
    70
  ],
  "ui_btn_hover": [
    110,
    90,
    160
  ],
  "ui_panel": [
    42,
    34,
    68
  ],
  "ui_text": [
    235,
    225,
    195
  ],
  "ui_text_dim": [
    150,
    140,
    120
  ]
}
